Pennsylvania,Philadelphia,East Falls,,,,,,,,,,,,,,,,,,,,,,,,,,,,,,,,,,,,,,,,,,,,,,,,,,,,,,,,"A quiet and scenic neighborhood along the Schuylkill River, East Falls combines suburban charm with proximity to the city.",Schuylkill River Trail: Bike or jog along the river. Falls Bridge: Take in the picturesque views of the area. Local Cafes: Relax in cozy coffee shops with neighborhood vibes.
Pennsylvania,Philadelphia,Fairmount North/Brewerytown,,,,,,,,,,,,,,,,,,,,,,,,,,,,,,,,,,,,,,,,,,,,,,,,,,,,,,,,"A hip and evolving area, Brewerytown is a mix of historic architecture and trendy new developments, while Fairmount offers an artistic and cultural atmosphere.",Philadelphia Museum of Art: Visit iconic exhibits and climb the famous Rocky steps. Girard Avenue Breweries: Sample craft beers in this revitalized district. Eastern State Penitentiary: Explore this historic and eerie landmark.
Pennsylvania,Philadelphia,Fairmount South,,,,,,,,,,,,,,,,,,,,,,,,,,,,,,,,,,,,,,,,,,,,,,,,,,,,,,,,"An artistic hub filled with young professionals and creatives, Fairmount South is lively yet approachable.",Barnes Foundation: Discover an incredible collection of Impressionist art. Local Bars and Cafes: Enjoy casual dining and vibrant nightlife. Fairmount Park: Explore miles of trails and open green spaces.
Pennsylvania,Philadelphia,Germantown,47454.0,22422.0,25032.0,3476.0,2589.0,2989.0,3097.0,4235.0,8224.0,6309.0,4360.0,2702.0,2977.0,4169.0,1546.0,781.0,33.1,8588.0,34825.0,213.0,948.0,160.0,280.0,13.0,23199.0,9694.0,1482.0,4981.0,730.0,2605.0,44528.0,36.3,20550.0,22933.0,0.0,414.0,642.0,327.0,1284.0,1706.0,1720.0,2681.0,2443.0,11716.0,8929.0,2730.0,5524.0,4877.0,41078.0,1057.0,44362.0,2276.0,987.0,1289.0,10175.0,"Steeped in history, Germantown is one of Philadelphia's oldest neighborhoods, blending historic landmarks with a tight-knit community feel.",Cliveden Mansion: Tour this historic Revolutionary War site. Germantown Avenue: Explore charming shops and cafes. Awbury Arboretum: Enjoy tranquil gardens and nature trails.
Pennsylvania,Philadelphia,Germantown East,,,,,,,,,,,,,,,,,,,,,,,,,,,,,,,,,,,,,,,,,,,,,,,,,,,,,,,,"An extension of Germantown, the east side offers a more residential, quieter atmosphere with strong community ties.","Historic Walking Tours: Learn about the area's rich history. Local Farmers Markets: Enjoy fresh, locally sourced goods. Neighborhood Parks: Relax in smaller, serene green spaces."
Pennsylvania,Philadelphia,Kensington/Fishtown,24601.0,13027.0,11574.0,1412.0,796.0,746.0,494.0,1233.0,8350.0,5071.0,2197.0,1404.0,1073.0,1431.0,295.0,99.0,34.2,19498.0,1220.0,160.0,1305.0,187.0,501.0,0.0,17777.0,6841.0,894.0,3251.0,1147.0,3987.0,23181.0,30.0,11662.0,12549.0,236.0,1965.0,245.0,211.0,364.0,329.0,244.0,275.0,632.0,8048.0,3406.0,903.0,7021.0,5166.0,101250.0,1671.0,22670.0,1850.0,955.0,895.0,2909.0,"One of Philadelphia's trendiest areas, Fishtown is known for its vibrant arts scene, while Kensington offers an up-and-coming vibe with industrial charm.","Frankford Avenue: Discover quirky shops, cafes, and live music venues. Graffiti Pier: Admire colorful street art and murals. Craft Breweries: Sample local beers at popular spots like Philadelphia Brewing Co."
Pennsylvania,Philadelphia,Logantown,34239.0,14497.0,19742.0,1560.0,2296.0,2254.0,2734.0,1923.0,4760.0,3967.0,4110.0,1723.0,2220.0,3856.0,2196.0,640.0,38.3,1707.0,29430.0,0.0,1181.0,48.0,48.0,0.0,15612.0,5563.0,941.0,4609.0,422.0,942.0,31549.0,37.8,14768.0,15836.0,0.0,0.0,199.0,280.0,323.0,1058.0,1509.0,2335.0,2575.0,7557.0,9813.0,1394.0,1930.0,1345.0,37053.0,894.0,31124.0,3051.0,1288.0,1763.0,6827.0,"A residential neighborhood with a mix of historic charm and urban development, Logantown offers a blend of local culture and accessibility.",La Salle University Art Museum: Explore diverse art collections. Logan Triangle Park: Enjoy open green spaces for recreation. Local Eateries: Discover hidden gems serving authentic Philly cuisine.
Pennsylvania,Philadelphia,Manayunk,5623.0,3255.0,2368.0,218.0,41.0,40.0,15.0,820.0,2803.0,714.0,256.0,124.0,212.0,229.0,109.0,42.0,29.5,4749.0,369.0,1.0,174.0,58.0,48.0,0.0,4630.0,2736.0,149.0,330.0,94.0,1044.0,5486.0,36.2,2982.0,3198.0,34.0,328.0,254.0,105.0,79.0,112.0,183.0,529.0,80.0,1494.0,350.0,52.0,2036.0,1384.0,109250.0,1784.0,5330.0,289.0,77.0,212.0,567.0,"Charming and hilly, Manayunk is a hotspot for young professionals and students, featuring a vibrant main street and scenic canal views.",Manayunk Towpath: Walk or bike along this picturesque trail. Main Street: Shop at boutiques and dine at eclectic restaurants. Manayunk Arts Festival: Attend this renowned outdoor art event.
Pennsylvania,Philadelphia,Mount Airy,,,,,,,,,,,,,,,,,,,,,,,,,,,,,,,,,,,,,,,,,,,,,,,,,,,,,,,,"Known for its progressive community and historic homes, Mount Airy is welcoming and diverse, with a focus on arts and culture.",Weavers Way Co-op: Visit this community-owned grocery for local goods. Mount Airy Art Garage: Enjoy exhibits and workshops by local artists. Historic Germantown: Explore nearby historical sites and museums.
Pennsylvania,Philadelphia,Nicetown,53996.0,26412.0,27584.0,3713.0,3456.0,4122.0,3100.0,3665.0,7456.0,6430.0,5741.0,3800.0,4228.0,4869.0,2659.0,757.0,36.4,5771.0,28361.0,69.0,1137.0,72.0,403.0,137.0,20605.0,5872.0,1164.0,4841.0,1170.0,2644.0,47331.0,36.6,20424.0,23140.0,30.0,213.0,83.0,346.0,425.0,1641.0,1013.0,1740.0,2743.0,14906.0,15335.0,2115.0,2260.0,970.0,30946.0,768.0,47992.0,5602.0,2406.0,3196.0,15483.0,"A working-class neighborhood with deep community roots, Nicetown is experiencing urban renewal and redevelopment.",Nicetown Park: Enjoy outdoor recreation and sports facilities. Community Events: Participate in local festivals and gatherings. Tabor Children’s House: Learn about the area’s educational initiatives.
Pennsylvania,Philadelphia,North Philadelphia – East,,,,,,,,,,,,,,,,,,,,,,,,,,,,,,,,,,,,,,,,,,,,,,,,,,,,,,,,"Rich in culture and history, North Philly East has a mix of bustling commercial areas and quiet residential streets.","Temple University: Explore campus attractions, including the Liacouras Center. Uptown Theater: Catch live performances in this historic venue. Local Food Scene: Try authentic Philly cheesesteaks and comfort food."
Pennsylvania,Philadelphia,North Philadelphia – West,,,,,,,,,,,,,,,,,,,,,,,,,,,,,,,,,,,,,,,,,,,,,,,,,,,,,,,,"A historically significant area, North Philly West is home to cultural landmarks and a resilient community spirit.","Philadelphia Zoo: Visit America’s first zoo, located nearby. Fairhill Square: Enjoy this community park and gathering space. Mural Arts Philadelphia: View powerful public art installations."
Pennsylvania,Philadelphia,Northeast – Bridesburg,,,,,,,,,,,,,,,,,,,,,,,,,,,,,,,,,,,,,,,,,,,,,,,,,,,,,,,,"A quiet, family-friendly neighborhood with a blue-collar heritage, Bridesburg offers a small-town feel within the city.","Bridesburg Recreation Center: Participate in sports and events. Heritage Train Station: Admire historic architecture and displays. Local Diners: Enjoy classic, hearty meals at neighborhood eateries."
Pennsylvania,Philadelphia,Northeast – Bustleton North/Somerton,,,,,,,,,,,,,,,,,,,,,,,,,,,,,,,,,,,,,,,,,,,,,,,,,,,,,,,,"Bustleton and Somerton are tranquil and suburban, known for their tree-lined streets and diverse communities.",Pennypack Park: Explore scenic trails and picnic areas. Orthodox Christian Churches: Visit stunning historic churches. International Markets: Shop for specialty foods from around the world.
Pennsylvania,Philadelphia,Northeast – Bustleton South,,,,,,,,,,,,,,,,,,,,,,,,,,,,,,,,,,,,,,,,,,,,,,,,,,,,,,,,"A continuation of Bustleton’s suburban appeal, the southern portion features a mix of residential charm and commercial convenience.",Local Parks: Enjoy family-friendly outdoor spaces. Cultural Festivals: Attend events celebrating the area’s diverse heritage. Neighborhood Restaurants: Discover authentic Eastern European cuisine.
Pennsylvania,Philadelphia,Northeast – Fox Chase,,,,,,,,,,,,,,,,,,,,,,,,,,,,,,,,,,,,,,,,,,,,,,,,,,,,,,,,"Quiet and tight-knit, Fox Chase is ideal for families, with spacious homes and plenty of green spaces.",Fox Chase Farm: Tour this educational urban farm. Lorimer Park: Hike or bike through this natural oasis. Fox Chase Cancer Center: Learn about the area’s contributions to medical innovation.
Pennsylvania,Philadelphia,Northeast – Frankford,,,,,,,,,,,,,,,,,,,,,,,,,,,,,,,,,,,,,,,,,,,,,,,,,,,,,,,,"A historically industrial area, Frankford is evolving with new businesses and a growing artistic community.",Frankford Avenue Arts Corridor: Discover unique art and creative spaces. The Historical Society of Frankford: Dive into the area’s rich past. Arrott Transportation Center: A hub for exploring Northeast Philly.
Pennsylvania,Philadelphia,Northeast – Holmesburg,,,,,,,,,,,,,,,,,,,,,,,,,,,,,,,,,,,,,,,,,,,,,,,,,,,,,,,,Holmesburg is a laid-back residential neighborhood with deep historical roots and plenty of local charm.,Holmesburg Prison: Explore this fascinating historic site. Pennypack Creek: Relax by the water and enjoy the serene views. Community Events: Join seasonal celebrations and parades.
Pennsylvania,Philadelphia,Northeast – Mayfair/Oxford Circle,,,,,,,,,,,,,,,,,,,,,,,,,,,,,,,,,,,,,,,,,,,,,,,,,,,,,,,,"A family-friendly area with an old-school Philly vibe, Mayfair and Oxford Circle offer a balance of urban and suburban lifestyles.",Mayfair Memorial Playground: A popular spot for families with kids. Cottman Avenue: Shop and dine along this bustling thoroughfare. Local Ice Cream Shops: Treat yourself to classic Philly desserts.
Pennsylvania,Philadelphia,Northeast – Rhawnhurst,,,,,,,,,,,,,,,,,,,,,,,,,,,,,,,,,,,,,,,,,,,,,,,,,,,,,,,,"A peaceful, residential area known for its diverse community and family-friendly atmosphere, Rhawnhurst is a blend of suburban and urban lifestyles.","Rhawnhurst Bustleton Library: Visit this library for community events and activities. Pennypack Park: Explore this nearby green space with trails and picnic areas. Ethnic Eateries: Savor authentic Jewish, Russian, and Asian cuisine."
Pennsylvania,Philadelphia,Northeast – Tacony,,,,,,,,,,,,,,,,,,,,,,,,,,,,,,,,,,,,,,,,,,,,,,,,,,,,,,,,"Tacony is a neighborhood with historic roots and a close-knit, working-class community vibe, offering scenic views of the Delaware River.",Tacony Music Hall: Admire this historic architectural gem. Disston Park: Enjoy sports facilities and open space. Tacony Library: Learn about local history in this community hub.
Pennsylvania,Philadelphia,Northeast – Torresdale North,,,,,,,,,,,,,,,,,,,,,,,,,,,,,,,,,,,,,,,,,,,,,,,,,,,,,,,,"A suburban-style area with riverside charm, Torresdale North offers a quiet and family-oriented environment.",Glen Foerd on the Delaware: Tour this historic mansion and enjoy riverside views. Torresdale Library: A great resource for community events and learning. Riverfront Recreation: Take advantage of boating and fishing opportunities.
Pennsylvania,Philadelphia,Northeast – Torresdale South,,,,,,,,,,,,,,,,,,,,,,,,,,,,,,,,,,,,,,,,,,,,,,,,,,,,,,,,"Similar to its northern counterpart, Torresdale South is a serene residential area with a focus on riverside living and natural beauty.",Linden Avenue Boat Launch: Perfect for kayaking or paddleboarding. Neighborhood Parks: Relax in local green spaces. Historic Homes: Explore beautiful colonial-era architecture.
Pennsylvania,Philadelphia,Northern Liberties/Spring Garden,,,,,,,,,,,,,,,,,,,,,,,,,,,,,,,,,,,,,,,,,,,,,,,,,,,,,,,,"A trendy and artistic neighborhood, Northern Liberties is a hub for young professionals and creatives, known for its lively atmosphere.",The Piazza: Attend outdoor events or dine at nearby restaurants. Yards Brewing Company: Enjoy local craft beer and brewery tours. Art Murals: Walk around and admire stunning public art installations.
Pennsylvania,Philadelphia,North Philadelphia – Yorktown,,,,,,,,,,,,,,,,,,,,,,,,,,,,,,,,,,,,,,,,,,,,,,,,,,,,,,,,"Yorktown offers a mix of residential comfort and urban accessibility, with a strong community identity.","Community Centers: Engage in local programs and workshops. Proximity to Temple University: Explore cultural and academic events. Local Markets: Shop at small, family-owned businesses."
Pennsylvania,Philadelphia,Oak Lane,,,,,,,,,,,,,,,,,,,,,,,,,,,,,,,,,,,,,,,,,,,,,,,,,,,,,,,,"A historic and green area, Oak Lane is known for its charming homes and diverse cultural scene.",Oak Lane Diner: A local favorite for classic comfort food. Awbury Arboretum: Wander through this beautiful natural preserve. Cultural Festivals: Attend events celebrating the area’s rich heritage.
Pennsylvania,Philadelphia,Olney,71360.0,33269.0,38091.0,6111.0,5737.0,5635.0,5290.0,4174.0,9484.0,8894.0,8691.0,4602.0,4305.0,5935.0,2191.0,311.0,34.2,7186.0,33519.0,285.0,8744.0,672.0,623.0,5.0,32012.0,16226.0,3731.0,4992.0,354.0,1368.0,62880.0,37.0,24593.0,25935.0,0.0,56.0,247.0,761.0,789.0,1129.0,2110.0,5493.0,4974.0,10376.0,15981.0,2757.0,4423.0,1846.0,46505.0,1005.0,56799.0,14541.0,6954.0,7587.0,13820.0,"Olney is a bustling, diverse neighborhood with a mix of cultures, making it a vibrant place to explore.","Einstein Medical Center Campus: Explore its history and contributions to healthcare. Chew Playground: A lively spot for recreation and community events. Global Cuisine: Try Korean, African, and Caribbean food at local eateries."
Pennsylvania,Philadelphia,Overbrook,33553.0,16186.0,17367.0,1991.0,2390.0,2846.0,2017.0,2549.0,5303.0,4331.0,3824.0,1801.0,2262.0,2999.0,915.0,325.0,34.3,2405.0,29400.0,52.0,260.0,92.0,36.0,0.0,16482.0,7766.0,1113.0,3967.0,496.0,1022.0,31477.0,32.9,13200.0,14879.0,14.0,227.0,42.0,379.0,292.0,684.0,1104.0,2187.0,2922.0,7028.0,6368.0,1304.0,3411.0,2593.0,53328.0,1069.0,30263.0,3269.0,1993.0,1276.0,4566.0,"A quiet, suburban-style neighborhood with tree-lined streets, Overbrook is a historic area with a welcoming community.",Overbrook Farms Historic District: Stroll through a beautiful collection of historic homes. Morris Park: Relax in this peaceful park. Saint Joseph’s University: Attend public lectures or sporting events.
Pennsylvania,Philadelphia,Port Richmond,,,,,,,,,,,,,,,,,,,,,,,,,,,,,,,,,,,,,,,,,,,,,,,,,,,,,,,,"Port Richmond combines industrial roots with a growing artistic community, creating a unique urban vibe.",Tacony-Palmyra Bridge Walk: Enjoy scenic views of the river. Port Richmond Trail: A great spot for biking and jogging. Polish Markets: Discover authentic Eastern European goods and cuisine.
Pennsylvania,Philadelphia,Roxborough,38381.0,18623.0,19758.0,2009.0,1321.0,1126.0,1182.0,2376.0,10004.0,5885.0,3589.0,2125.0,2434.0,3415.0,1881.0,1034.0,36.3,29357.0,4830.0,40.0,1029.0,155.0,255.0,6.0,24576.0,14267.0,1004.0,2421.0,547.0,4686.0,36639.0,30.8,18158.0,19207.0,13.0,915.0,596.0,692.0,1712.0,1800.0,4192.0,2509.0,1250.0,5528.0,5702.0,2075.0,9411.0,7051.0,88261.0,1543.0,35611.0,2299.0,1141.0,1158.0,5101.0,"Roxborough is a cozy, residential neighborhood with a small-town feel and plenty of outdoor attractions.",Wissahickon Valley Park: Hike through scenic trails and enjoy nature. Roxborough Music Festival: Celebrate local talent and live music. Historic Ridge Avenue: Explore shops and cafes along this charming street.
Pennsylvania,Philadelphia,Southwest Philadelphia – Eastwick,,,,,,,,,,,,,,,,,,,,,,,,,,,,,,,,,,,,,,,,,,,,,,,,,,,,,,,,"A quiet and largely residential area, Eastwick is close to the airport and features plenty of green spaces.",John Heinz National Wildlife Refuge: Birdwatch and explore wetlands. Eastwick Park: A great spot for sports and picnics. Local Food Trucks: Taste diverse cuisines from nearby food vendors.
Pennsylvania,Philadelphia,Southwest Philadelphia – Kingsessing,,,,,,,,,,,,,,,,,,,,,,,,,,,,,,,,,,,,,,,,,,,,,,,,,,,,,,,,"Kingsessing is an energetic neighborhood with a mix of residential homes, urban development, and green spaces, creating a lively yet relaxed atmosphere.","Kingsessing Park: Enjoy recreational facilities like basketball courts, walking paths, and playgrounds. Spruce Hill Community Garden: Participate in gardening programs or relax in this community space. Local Cafes and Bars: Explore neighborhood spots for coffee, beer, and casual bites."
Pennsylvania,Philadelphia,Southwest Philadelphia – Paschall/Elmwood,,,,,,,,,,,,,,,,,,,,,,,,,,,,,,,,,,,,,,,,,,,,,,,,,,,,,,,,"This residential area features quiet streets with easy access to the airport and nearby commercial areas. The neighborhood is diverse, with a strong sense of community.","Paschall Recreation Center: Engage in sports or attend local events. Elmwood Park Shopping District: Explore retail shops, restaurants, and markets. Local Community Events: Participate in neighborhood gatherings and cultural festivals."
Pennsylvania,Philadelphia,South Philadelphia – East,,,,,,,,,,,,,,,,,,,,,,,,,,,,,,,,,,,,,,,,,,,,,,,,,,,,,,,,"South Philly’s East neighborhood is vibrant, with a combination of old-world charm and modern-day amenities. It’s home to a variety of cultural influences, particularly Italian and Mexican.","Italian Market: Shop for fresh produce, meats, and cheeses at this historic market. Spruce Street Harbor Park: Enjoy outdoor activities and food vendors along the waterfront. South Street: Explore this lively street lined with shops, cafes, and live music venues."
Pennsylvania,Philadelphia,South Philadelphia – Queen Village/Bella Vista,,,,,,,,,,,,,,,,,,,,,,,,,,,,,,,,,,,,,,,,,,,,,,,,,,,,,,,,"Known for its hip, charming vibe, Queen Village and Bella Vista offer cobblestone streets, small boutiques, and a mix of upscale and bohemian residents.",Headhouse Square: Visit this historic market square for shopping and events. Mifflin Square Park: Enjoy a peaceful park with a community feel. Local Dining Spots: Enjoy authentic Italian eateries and trendy cafes.
Pennsylvania,Philadelphia,South Philadelphia – Schuylkill,,,,,,,,,,,,,,,,,,,,,,,,,,,,,,,,,,,,,,,,,,,,,,,,,,,,,,,,"A diverse neighborhood with a mix of residential and commercial properties, Schuylkill is known for its proximity to the river and vibrant street life.","Schuylkill River Trail: Walk, run, or bike along this scenic path. Schuylkill Banks Boardwalk: Take in views of the river and Philadelphia skyline. Catch a Phillies Game: Head to the nearby stadium for a baseball game."
Pennsylvania,Philadelphia,South Philadelphia – West,,,,,,,,,,,,,,,,,,,,,,,,,,,,,,,,,,,,,,,,,,,,,,,,,,,,,,,,"South Philly West combines residential streets with diverse shopping and dining, offering a mix of working-class roots and a growing, vibrant community.","Sports Complex: Visit the Wells Fargo Center for basketball or concerts, or Lincoln Financial Field for Eagles games. Pat’s King of Steaks: Try the famous Philly cheesesteak from one of the originators. Newbold: Discover a neighborhood on the rise with trendy restaurants and bars."
Pennsylvania,Philadelphia,West Philadelphia – West Market,,,,,,,,,,,,,,,,,,,,,,,,,,,,,,,,,,,,,,,,,,,,,,,,,,,,,,,,"West Market is a dynamic, fast-evolving area with a diverse population, offering a mixture of urban energy and residential tranquility.","The Philadelphia Zoo: Spend a day with family exploring the diverse animal exhibits. Penn Museum: Visit this museum for an in-depth look at ancient civilizations. University City: Walk through the academic district, visiting campus landmarks and dining spots."
Pennsylvania,Philadelphia,West Philadelphia – University City,,,,,,,,,,,,,,,,,,,,,,,,,,,,,,,,,,,,,,,,,,,,,,,,,,,,,,,,"A bustling academic hub, University City is home to major universities, tech startups, and a vibrant student population. It’s known for a dynamic cultural scene and intellectual atmosphere.","University of Pennsylvania’s Museum of Archaeology: Explore ancient treasures and artifacts. Spruce Street Harbor Park: Enjoy outdoor activities like kayaking, lawn games, and food trucks. Clark Park: Relax in this community hub with a farmers' market and open-air theater performances."
Pennsylvania,Philadelphia,Wynnefield/West Park,,,,,,,,,,,,,,,,,,,,,,,,,,,,,,,,,,,,,,,,,,,,,,,,,,,,,,,,"A largely residential neighborhood, Wynnefield is characterized by a family-friendly atmosphere, large homes, and green spaces, giving it a suburban feel with easy access to the city.","Fairmount Park: Explore one of the largest urban parks in the country, with trails, gardens, and historical sites. Philadelphia Museum of Art: Visit the iconic museum and take a picture on the famous ""Rocky Steps."" St. Joseph's University: Attend public events, sports games, or visit the scenic campus."
Tennessee,Nashville,Antioch,99800.0,48921.0,50879.0,8020.0,8126.0,7501.0,6435.0,6505.0,18113.0,16559.0,11803.0,4559.0,4605.0,5422.0,1680.0,472.0,32.4,42897.0,37275.0,352.0,5226.0,174.0,166.0,25.0,56439.0,39278.0,5926.0,359.0,343.0,5313.0,81564.0,28.7,36255.0,38863.0,362.0,5983.0,9504.0,6820.0,8575.0,5070.0,1450.0,470.0,353.0,276.0,16834.0,5446.0,13433.0,5357.0,67270.0,1352.0,71810.0,27766.0,11108.0,16658.0,9543.0,A suburban area known for its family-friendly atmosphere and suburban living. It offers a quieter lifestyle while being well-connected to the city.,"Nashville Shores Lakeside Resort: Enjoy outdoor activities, including water sports and mini-golf. Antioch Park: A relaxing park with walking trails and sports fields. Shopping at Global Mall at the Crossings: Explore a variety of stores, restaurants, and cultural experiences."
Tennessee,Nashville,Bakers Grove,38095.0,18158.0,19937.0,2244.0,1901.0,2132.0,2070.0,2182.0,6944.0,5578.0,4323.0,3122.0,2118.0,3003.0,1847.0,631.0,37.5,24415.0,9804.0,29.0,506.0,235.0,35.0,0.0,22090.0,15419.0,1411.0,310.0,59.0,3438.0,34053.0,28.2,17136.0,18486.0,262.0,2220.0,3895.0,3157.0,3396.0,2575.0,2341.0,283.0,184.0,173.0,5969.0,2291.0,7428.0,3410.0,68894.0,1337.0,35371.0,2553.0,1158.0,1395.0,6114.0,"A quiet, residential area with a blend of suburban and rural living. It offers a peaceful environment close to Nashville's amenities.",Hickory Hollow Farm: A charming local farm with a community-focused environment. Explore Local Trails: Ideal for a leisurely walk or bike ride in nature.
Tennessee,Nashville,Bellmont Hillsboro,18996.5,8626.0,10370.5,763.0,794.0,697.0,2788.0,3178.5,4151.5,2153.0,1398.5,711.0,753.0,1083.5,386.5,139.0,27.4,14573.5,2299.5,10.5,1277.0,337.0,396.5,0.0,11626.0,6579.5,393.0,110.5,1048.0,2493.0,17910.5,17.0,6936.5,8059.0,71.5,1817.0,798.5,313.5,482.0,654.5,576.5,1028.5,523.5,1793.5,848.5,337.5,4299.0,3778.0,94222.5,1670.5,17273.0,1588.0,630.5,957.5,1480.0,"Located close to Belmont University, this neighborhood has a mix of college students, professionals, and young families. It's lively yet maintains a calm suburban feel.","Belmont Boulevard: A trendy street full of cafes, shops, and restaurants. Belmont Mansion: Visit this historic landmark, now a museum, and explore the lush grounds. Walk through Belmont University Campus: Beautiful, historic campus with vibrant student life."
Tennessee,Nashville,Bells Bend,15115.0,6947.0,8168.0,1034.0,693.0,1059.0,930.0,341.0,2383.0,2145.0,1778.0,891.0,947.0,2025.0,714.0,175.0,40.6,3391.0,10443.0,0.0,189.0,5.0,19.0,0.0,6638.0,4653.0,364.0,104.0,75.0,618.0,13033.0,25.1,5945.0,6447.0,54.0,608.0,526.0,411.0,895.0,1726.0,1215.0,429.0,355.0,228.0,3931.0,575.0,1793.0,1022.0,55813.0,1097.0,13994.0,245.0,163.0,82.0,2639.0,"Bells Bend has a rural, open-space vibe with large properties and farmland. It offers a peaceful, country-like atmosphere while still being near the city.","Bells Bend Park: A large, scenic park with trails for walking, hiking, and cycling. Farmers Markets: Visit local markets to get fresh, homegrown produce and artisanal goods."
Tennessee,Nashville,Bordeaux,12607.0,5674.666666666667,6932.333333333333,710.6666666666666,408.3333333333333,604.3333333333334,1196.3333333333333,953.3333333333334,2998.0,1456.6666666666667,1314.0,531.6666666666666,653.0,1258.3333333333333,380.3333333333333,142.0,33.26666666666667,3702.3333333333335,8031.666666666667,11.666666666666666,134.33333333333334,29.666666666666668,17.666666666666668,16.0,6830.0,4233.666666666667,517.6666666666666,329.0,196.33333333333331,786.0,11017.333333333334,23.7,5369.0,6036.333333333333,106.33333333333331,1404.0,663.3333333333334,377.6666666666667,555.0,761.3333333333334,674.6666666666666,498.3333333333333,289.6666666666667,706.0,2279.6666666666665,318.0,2025.6666666666667,1309.3333333333333,60264.333333333336,1246.0,12004.333333333334,272.3333333333333,130.33333333333334,142.0,2022.0,"A mixed residential and commercial neighborhood known for its historic roots and close-knit community feel. It's close to downtown, yet more laid-back and affordable.","One Hundred Oaks Mall: Shop for popular brands in this local shopping center. Bordeaux Community Center: Participate in community activities and events. Explore Local Parks: Spend time at nearby parks, perfect for outdoor recreation."
Tennessee,Nashville,Brandywine Farms,23297.0,11766.0,11531.0,1022.0,1223.0,1632.0,1537.0,747.0,2624.0,2926.0,3660.0,1884.0,1950.0,2397.0,1329.0,366.0,44.9,19256.0,2467.0,0.0,370.0,0.0,0.0,0.0,12579.0,9523.0,1120.0,87.0,38.0,1266.0,21877.0,28.9,9485.0,9985.0,76.0,684.0,1053.0,1627.0,1712.0,2145.0,954.0,597.0,172.0,965.0,3968.0,1491.0,4888.0,1932.0,87465.0,1330.0,22236.0,1035.0,616.0,419.0,3552.0,"A quiet, suburban area with spacious homes and a family-oriented atmosphere. It offers a peaceful escape from the hustle and bustle of downtown Nashville.",Nearby Green Spaces: Take a walk or bike ride through neighborhood parks. Brandywine Farms Community Events: Check out local events for a taste of community life.
